{
  "$schema": "./schema.json",
  "format": "awl",
  "version": "1.0.0",
  "name": "hardroad.default",
  "description": "Evidence-based default agent workflow: cheap parallel read-only exploration -> frontier planning -> delegation-aware implementation (single writer) -> clean-context diff review -> deterministic verification -> bounded fix/replan loop -> report with telemetry.",
  "meta": {
    "schemaVersion": "2026.09",
    "source": "Cognition 'Multi-Agents: What's Actually Working'; Cognition Devin Fusion; Cognition 'Making Fable Cheaper Than Opus'; Anthropic multi-agent research system; LangChain read-vs-write parallelization; Co-Coder communication/compute tradeoff; OpenTelemetry GenAI semantic conventions.",
    "estimate": {
      "pricesFrom": "usdPerMillionInput/usdPerMillionOutput",
      "perState": "expectedTokens",
      "budgetUsd": 5.0,
      "refit": true
    }
  },
  "models": {
    "frontier": { "provider": "<provider>", "model": "<frontier-model>", "usdPerMillionInput": 5.0, "usdPerMillionOutput": 25.0, "role": "planning, design, ambiguity, final judgement" },
    "cheap":   { "provider": "<provider>", "model": "<cheap-model>",   "usdPerMillionInput": 0.25, "usdPerMillionOutput": 2.0, "role": "mechanical edits, exploration, boilerplate" },
    "review":  { "provider": "<provider>", "model": "<different-family-model>", "usdPerMillionInput": 3.0, "usdPerMillionOutput": 15.0, "role": "clean-context diff review; cross-vendor blind-spot coverage" }
  },
  "agents": {
    "explorer": { "model": "cheap", "readOnly": true, "cleanContext": true, "tools": ["read", "grep", "glob"], "prompt": "Read the target repo scope, map relevant code and docs, and return file paths + snippets. Do not modify anything." },
    "planner":  { "model": "frontier", "cleanContext": true, "prompt": "Write a spec-quality brief: goal, constraints, edge cases, definition of done, and a decision on delegability. Never dictate full file contents - state outcomes and constraints." },
    "writer":   { "model": "frontier", "prompt": "Implement per the spec. Single writer: make all edits yourself, in a coherent thread." },
    "sidekick": { "model": "cheap", "prompt": "Apply the spec exactly. The plan is fixed: do not design, just implement and run the verification the main agent specified." },
    "reviewer": { "model": "review", "readOnly": true, "cleanContext": true, "tools": ["read", "grep", "glob", "git"], "prompt": "You are a clean-context reviewer. You did not write this code. Review the diff only, then re-discover context. Flag bugs, blind spots, spec non-compliance with severity and file:line." }
  },
  "telemetry": {
    "conventions": "opentelemetry-genai",
    "operationName": "chat",
    "record": [
      "gen_ai.usage.input_tokens",
      "gen_ai.usage.output_tokens",
      "gen_ai.usage.cache_read.input_tokens",
      "gen_ai.provider.name",
      "gen_ai.request.model",
      "durationMs",
      "attempts",
      "loops",
      "outcome",
      "costUsd"
    ],
    "rating": {
      "scale": [1, 2, 3, 4, 5],
      "labels": ["complete", "needs_revision", "blocked", "cancelled"]
    }
  },
  "subflows": {
    "explore_repo": {
      "description": "One read-only cheap exploration pass over a repo scope. Perfectly parallelizable: reads only, no writes, isolated context.",
      "start": "scan",
      "states": {
        "scan": {
          "type": "task",
          "kind": "llm",
          "agent": "explorer",
          "label": "Scan",
          "metrics": { "emit": true },
          "expectedTokens": { "input": 4000, "output": 1500 },
          "end": true
        }
      }
    },
    "fix_attempt": {
      "description": "A bounded corrective pass: writer responds to review + verification feedback, then re-verifies.",
      "start": "apply",
      "states": {
        "apply": {
          "type": "task",
          "kind": "llm",
          "agent": "writer",
          "label": "Apply fixes",
          "context": { "input": "reviewFeedback+verifyOutput" },
          "metrics": { "emit": true },
          "expectedTokens": { "input": 6000, "output": 2500 },
          "next": "reverify"
        },
        "reverify": {
          "type": "task",
          "kind": "tool",
          "label": "Re-verify",
          "run": { "command": "lint && test && typecheck" },
          "metrics": { "emit": true },
          "end": true
        }
      }
    }
  },
  "start": "explore",
  "states": {
    "explore": {
      "type": "parallel",
      "label": "Explore sub-repos (cheap, read-only, parallel)",
      "description": "Fan out one cheap read-only agent per scope. Research: reads parallelize cleanly; context isolation keeps the frontier context lean.",
      "completion": "all",
      "branches": [
        { "label": "api/",            "flow": "explore_repo", "args": { "scope": "api/", "search": "routes/, store/prisma/, lib/" } },
        { "label": "ui/",             "flow": "explore_repo", "args": { "scope": "ui/", "search": "src/Components/, src/SubModules/treks-ui-models/" } },
        { "label": "marketing-site/", "flow": "explore_repo", "args": { "scope": "marketing-site/", "search": "src/app/, zenstack/schema.zmodel" } },
        { "label": "swift-app/",      "flow": "explore_repo", "args": { "scope": "swift-app/", "search": "Models/, Views/" } }
      ],
      "metrics": { "emit": true },
      "next": "plan"
    },
    "plan": {
      "type": "task",
      "kind": "llm",
      "agent": "planner",
      "label": "Plan (frontier, single writer)",
      "description": "Frontier model owns the judgment. Produces a spec artifact - outcome constraints, not dictated code.",
      "context": { "input": "exploreSummaries+task" },
      "artifact": { "kind": "spec", "path": "artifacts/spec.md", "required": true },
      "expectedTokens": { "input": 9000, "output": 3500 },
      "metrics": { "emit": true },
      "evidence": [
        { "source": "Devin Fusion", "finding": "Frontier intelligence should be spent on the plan, ambiguity, and final review - not on mechanical volume." },
        { "source": "Making Fable Cheaper Than Opus", "finding": "The quality lever is the brief: enumerate constraints, edge cases, and a definition of done. Fable's constraint-rich briefs beat Opus's dictated file contents." },
        { "source": "VS Code context-engineering guide", "finding": "An implementation plan is a first-class artifact you can read, diff, and gate before any side effect fires." }
      ],
      "next": "route"
    },
    "route": {
      "type": "choice",
      "label": "Route by delegability",
      "description": "Judgment decides: mechanical+safe -> cheap sidekick; judgement-bound or serial-debug -> frontier writer stays on it. Research: 'the same judgment that writes a good brief also knows when not to write one.'",
      "branches": [
        { "label": "mechanical", "when": { "path": "$.plan.delegability", "op": "equals", "value": "mechanical" }, "next": "implement_sidekick" },
        { "label": "judgment",   "when": { "path": "$.plan.delegability", "op": "equals", "value": "judgment" },   "next": "implement_frontier" }
      ],
      "default": "implement_frontier",
      "evidence": [
        { "source": "Devin Fusion", "finding": "Delegation controls what work stays with the expensive model; routing decides whether the expensive model is involved at all." },
        { "source": "Making Fable Cheaper Than Opus", "finding": "Forcing delegation decreases performance - it just delegates the wrong things. Delegability is itself a judgment call." },
{ "source": "Devin Fusion bad example", "finding": "When the judgment IS the deliverable, delegating it backfires (hard React feature scored 27/100). Mechanical work hands off cleanly." }
      ]
    },
    "implement_sidekick": {
      "type": "task",
      "kind": "llm",
      "agent": "sidekick",
      "label": "Implement (cheap sidekick)",
      "description": "Fixed spec, mechanical work: cheap model does the volume. Writes stay single-threaded - exactly one writer, never parallel writers.",
      "retry": { "maxAttempts": 3, "backoffMs": 2000 },
      "expectedTokens": { "input": 12000, "output": 6000 },
      "metrics": { "emit": true },
      "evidence": [
        { "source": "Frontier-planner cheap-executor consensus", "finding": "Once the plan is fixed, throughput and cost matter more than raw IQ." },
        { "source": "LangChain / Cognition", "finding": "Writes must stay single-threaded; parallel writes fragment implicit decisions." }
      ],
      "next": "review"
    },
    "implement_frontier": {
      "type": "task",
      "kind": "llm",
      "agent": "writer",
      "label": "Implement (frontier writer)",
      "description": "Judgement-bound task: frontier model stays the single writer for the whole thread.",
      "retry": { "maxAttempts": 3, "backoffMs": 2000 },
      "expectedTokens": { "input": 16000, "output": 8000 },
      "metrics": { "emit": true },
      "next": "review"
    },
    "review": {
      "type": "task",
      "kind": "llm",
      "agent": "reviewer",
      "label": "Review diff (clean context, other family)",
      "description": "Read-only agent with a fresh context that sees the diff, never the author's session. Different model family when possible. Highest-leverage addition.",
      "context": { "input": "diff" },
      "expectedTokens": { "input": 8000, "output": 2000 },
      "metrics": { "emit": true },
      "evidence": [
        { "source": "Cognition 'What's Actually Working'", "finding": "A clean-context reviewer with no shared context catches bugs the author cannot see; shorter context = more intelligence on the diff." },
        { "source": "fusion-conductor", "finding": "Main and sidekick from different vendors means every diff gets an independent second-family read." },
        { "source": "Pioneer AI", "finding": "The model that wrote the code is often the worst reviewer of it." }
      ],
      "next": "verify"